{
  "schemaVersion": 1,
  "packageVersion": 4,
  "languageId": "ja",
  "displayName": "Japanese",
  "nativeName": "日本語",
  "direction": "ltr",
  "strings": {
    "app.name": "nigeyo",
    "common.back": "戻る",
    "common.cancel": "キャンセル",
    "common.continue": "続ける",
    "common.done": "完了",
    "common.close": "閉じる",
    "common.copy": "コピー",
    "common.copied": "コピーしました",
    "common.retry": "もう一度試す",
    "common.unknown": "不明",
    "common.stepCounter": "{current} / {total}",
    "training.badge": "訓練",
    "training.badgeLong": "訓練 / DRILL",
    "training.end": "訓練を終了",
    "manual.end": "案内を終了",
    "onboarding.language.eyebrow": "WELCOME",
    "onboarding.language.title": "備えて、\n次の一歩へ。",
    "onboarding.language.body": "あなたの言語で、見てわかる防災案内。",
    "onboarding.language.continue": "続ける →",
    "onboarding.language.footnote": "言語はいつでも変更できます。",
    "onboarding.places.nav": "初期設定",
    "onboarding.places.eyebrow": "YOUR EVERYDAY PLACES",
    "onboarding.places.title": "いつもの場所から、\n備えよう。",
    "onboarding.places.body": "自宅と学校の近くにある避難場所を確認します。",
    "onboarding.places.home": "自宅",
    "onboarding.places.university": "学校・大学",
    "onboarding.places.searchHint": "住所・施設名を検索",
    "onboarding.places.pinHint": "検索できないときは、地図でピンを指定できます。",
    "onboarding.places.pinUse": "この位置を使う",
    "onboarding.places.pinTitle": "地図でピンを指定",
    "onboarding.places.selected": "選択済み",
    "onboarding.places.privacyTitle": "入力した住所は保存しません",
    "onboarding.places.privacyBody": "場所の選定後、保存するのは公開避難施設の情報だけです。",
    "onboarding.places.next": "避難場所の候補を見る",
    "onboarding.places.footnote": "学校が未登録でも、あとから設定できます。",
    "onboarding.places.searching": "検索中…",
    "onboarding.places.noResults": "候補が見つかりません。地図でピンを指定してください。",
    "onboarding.destinations.nav": "避難場所を確認",
    "onboarding.destinations.eyebrow": "SAVE YOUR DESTINATIONS",
    "onboarding.destinations.title": "地震と津波で、\n避難場所を分ける。",
    "onboarding.destinations.body": "施設名・住所は公式データの原文で表示します。",
    "onboarding.destinations.slot": "{place} × {hazard}",
    "onboarding.destinations.none": "近くの対応施設がありません",
    "onboarding.destinations.noneBody": "未登録のまま保存できます",
    "onboarding.destinations.notSet": "場所が未設定です",
    "onboarding.destinations.walkFailed": "徒歩距離未取得",
    "onboarding.destinations.walkUnavailable": "徒歩距離を比較できませんでした。直線距離順に表示しています。",
    "onboarding.destinations.note": "近さは、安全や到達可能性を保証しません。",
    "onboarding.destinations.save": "この避難場所を保存する",
    "onboarding.destinations.loading": "近くの避難場所を探しています…",
    "onboarding.destinations.change": "候補を変える",
    "onboarding.lock.nav": "ロック画面の準備",
    "onboarding.lock.eyebrow": "ONE LESS THING TO THINK ABOUT",
    "onboarding.lock.title": "ロック画面にも、\n次の行動を。",
    "onboarding.lock.body": "地震・津波の2つのショートカットを設定します。",
    "onboarding.lock.step1": "01  通知を許可する",
    "onboarding.lock.step1Body": "iPhoneの確認画面で許可します。",
    "onboarding.lock.step2": "02  地震・津波対応のショートカット追加",
    "onboarding.lock.step2Body": "セットアップで2つのショートカットを追加済みです。",
    "onboarding.lock.step3": "03  ロック中の動作をテスト",
    "onboarding.lock.step3Body": "手動実行・自動実行をそれぞれ確認。",
    "onboarding.lock.shortcuts": "地震・津波をまとめて設定",
    "onboarding.lock.liveActivity": "Live Activity を確認",
    "onboarding.lock.liveActivityBody": "ロック画面の表示をテストする",
    "onboarding.lock.note": "追加・有効化にはiPhone上の操作が必要です。",
    "onboarding.lock.finish": "準備を完了する",
    "onboarding.lock.later": "あとで設定する",
    "onboarding.lock.notificationsAllowed": "通知は許可されています",
    "onboarding.lock.notificationsDenied": "通知が許可されていません。設定アプリで許可してください。",
    "onboarding.lock.testNotification": "通知をテストする",
    "home.settings": "設定",
    "home.eyebrow": "SMALL STEPS, MORE CONFIDENCE",
    "home.title": "もしものときに、\n迷わないために。",
    "home.practiceTitle": "まずは、練習。",
    "home.practiceBody": "画面を見ながら\n行動を確かめよう。",
    "home.practiceStart": "訓練をはじめる →",
    "home.feltShaking": "揺れを感じました",
    "home.feltShakingBody": "今すぐ、身を守る案内を開く",
    "home.savedPlaces": "YOUR SAVED PLACES",
    "home.destinations": "避難場所を確認",
    "home.destinationsBody": "自宅・学校 / 地震・津波の4枠",
    "home.offlineTitle": "✓  保存した案内はオフラインでも",
    "home.offlineBody": "地図や外部の経路案内には通信が必要です。",
    "home.resumeTitle": "前の案内が残っています",
    "home.resumeBody": "開始から30分以上たっています。続けますか？",
    "home.resume": "前の訓練を続ける",
    "home.discard": "終了する",
    "home.missingSession": "案内の記録が見つかりません",
    "home.missingSessionBody": "訓練や手動の案内は、ここから始められます。",
    "practice.nav": "訓練",
    "practice.eyebrow": "PRACTICE AT YOUR OWN PACE",
    "practice.title": "体で覚える、\nもしもの一歩。",
    "practice.body": "安全な場所で訓練してください。",
    "practice.earthquake": "地震の訓練",
    "practice.earthquakeBody": "頭を守る → 安全確認 → 避難場所",
    "practice.tsunami": "地震 ＋ 津波の訓練",
    "practice.tsunamiBody": "地震のあと、津波の訓練通知が届きます",
    "practice.lockTitle": "ロックして、通知を待ちます",
    "practice.lockBody": "開始後、5〜15秒の間に訓練通知が届きます。実際の地震情報は使用しません。",
    "practice.start": "地震の訓練を開始する",
    "practice.startTsunami": "地震＋津波の訓練を開始する",
    "practice.footnote": "いつでもキャンセルできます。",
    "practice.notificationsDenied": "通知が許可されていないため、訓練通知を予約できません。",
    "waiting.eyebrow": "READY WHEN YOU ARE",
    "waiting.title": "iPhoneをロックして\nお待ちください。",
    "waiting.body": "まもなく訓練通知が届きます。通知が来たら、安全に操作できるときに案内を開いてください。",
    "waiting.scheduled": "訓練通知を予約しました",
    "waiting.scheduledBody": "画面を消しても、予約は続きます。",
    "waiting.cancel": "訓練をキャンセル",
    "waiting.footnote": "この画面から自動で安全確認へ進みません。",
    "waiting.openNow": "今すぐ案内を開く",
    "guide.protect.step": "01 / 身を守る",
    "guide.protect.title": "地震です。\n頭を守ってください。",
    "guide.protect.short": "低い姿勢で、頭を守って。",
    "guide.protect.body": "低い姿勢で、頭を守ってください。\n安全に操作できるまで、身を守りましょう。",
    "guide.shakingQuestion": "揺れがおさまりましたか",
    "guide.shakingHint": "揺れがおさまってから、タップしてください。",
    "guide.checks.step": "02 / SAFETY CHECKS",
    "guide.checks.title": "あわてず、\nまわりを確かめる。",
    "guide.surroundings.title": "安全確保",
    "guide.surroundings.body": "ガラス・家具・落下物・足元に注意。",
    "guide.fire.title": "火を消す",
    "guide.fire.body": "揺れがおさまり、安全にできる場合だけ。危険な場所へ戻らない。",
    "guide.exit.title": "扉を開ける",
    "guide.exit.body": "安全にできる場合は、出口を確保。",
    "guide.unsafeButton": "安全でないと感じたら",
    "guide.unsafeHint": "必要なときは、避難場所を確認できます。",
    "guide.tsunami.step": "TSUNAMI / 津波の訓練",
    "guide.tsunami.stepManual": "TSUNAMI / 津波",
    "guide.tsunami.title": "津波がきます。\n高台へ。",
    "guide.tsunami.short": "津波がきます、高台へ。",
    "guide.tsunami.body": "津波の危険があります。\n高台などへ避難してください。",
    "guide.tsunami.drillTitle": "これは津波の訓練です",
    "guide.tsunami.drillBody": "実際の津波の発生を示すものではありません。",
    "guide.tsunami.sourceInfo": "元情報 {time}・{area}・{grade}",
    "guide.tsunami.checkPlaces": "避難場所を確認する",
    "guide.tsunami.grade.MajorWarning": "大津波警報",
    "guide.tsunami.grade.Warning": "津波警報",
    "guide.tsunami.grade.Watch": "津波注意報",
    "guide.tsunami.grade.Unknown": "不明",
    "place.nav": "避難場所",
    "place.navTsunami": "津波の避難場所",
    "place.eyebrow": "WHERE ARE YOU NOW?",
    "place.title": "いま、\nどこにいますか。",
    "place.body": "今いる場所に合わせて、避難場所を表示します。",
    "place.bodyTsunami": "高台などへ避難してください。津波に対応する避難場所を確認します。",
    "place.tsunamiOnly": "津波対応施設のみ",
    "place.home": "家",
    "place.homeBody": "自宅周辺の保存した避難場所",
    "place.homeBodyTsunami": "自宅周辺の津波用避難場所",
    "place.university": "学校",
    "place.universityBody": "学校周辺の保存した避難場所",
    "place.universityBodyTsunami": "学校周辺の津波用避難場所",
    "place.other": "その他",
    "place.otherBody": "現在地から近くの候補を探す",
    "place.otherBodyTsunami": "現在地から津波対応施設を探す",
    "place.notSaved": "未登録です。「その他」を選んでください。",
    "place.locationNoteTitle": "現在地は、この操作のときだけ",
    "place.locationNoteBody": "必要なときに位置情報の許可をお願いします。現在地は保存しません。",
    "place.tsunamiNote": "近くの対応施設が見つからない場合も、地震専用の施設は表示しません。",
    "place.backToChecks": "安全確認に戻る",
    "place.backToTsunami": "津波の案内に戻る",
    "candidates.nav": "その他の避難場所",
    "candidates.navTsunami": "津波の避難場所",
    "candidates.eyebrow": "NEAR YOUR CURRENT LOCATION",
    "candidates.eyebrowTsunami": "TSUNAMI-COMPATIBLE",
    "candidates.title": "近くの避難場所",
    "candidates.titleTsunami": "高台の避難場所",
    "candidates.body": "地震に対応する候補を、直線距離順に表示しています。",
    "candidates.bodyTsunami": "現在地からの直線距離順に表示しています。",
    "candidates.note": "直線距離は徒歩距離ではありません。道路や施設の状況、自治体の案内を優先してください。",
    "candidates.confirm": "選んだ避難場所を確認する",
    "candidates.locating": "現在地を確認しています…",
    "candidates.searching": "近くの施設を探しています…",
    "candidates.lowAccuracy": "現在地の精度が低い可能性があります（{accuracy}）。周囲の状況も確認してください。",
    "candidates.saved": "保存した避難場所",
    "hazard.earthquake": "地震",
    "hazard.tsunami": "津波",
    "hazard.earthquakeSupported": "地震対応",
    "hazard.tsunamiSupported": "津波対応",
    "distance.straight": "直線距離 {distance}",
    "distance.walking": "徒歩 {distance}",
    "distance.straightLabel": "現在地からの直線距離",
    "distance.savedLabel": "保存時の距離",
    "destination.nav": "避難場所の確認",
    "destination.mapCaption": "位置のイメージ",
    "destination.note": "近さは安全や到達可能性を保証しません。\n道路・建物の現況と自治体の案内を優先してください。",
    "destination.go": "この避難場所へ向かう",
    "destination.openMap": "Apple マップ で位置を確認 ↗",
    "destination.copyAddress": "住所と座標をコピー",
    "destination.openFailed": "Apple マップ を開けませんでした。住所と座標をコピーできます。",
    "onTheWay.nav": "避難を開始",
    "onTheWay.badge": "避難先を選びました",
    "onTheWay.badgeTsunami": "津波対応の避難先",
    "onTheWay.eyebrow": "YOUR NEXT STEP",
    "onTheWay.eyebrowTsunami": "KEEP MOVING TO HIGHER GROUND",
    "onTheWay.title": "周囲を確かめながら、\n避難場所へ。",
    "onTheWay.titleTsunami": "高台などへ、\n避難してください。",
    "onTheWay.mapsTitle": "経路案内は Apple マップ へ",
    "onTheWay.mapsBody": "現在地・道路の状況を確認しながら進んでください。",
    "onTheWay.mapsBodyTsunami": "周囲の状況と自治体の避難案内を優先してください。",
    "onTheWay.openMaps": "Apple マップ で経路を開く ↗",
    "locationError.nav": "その他の避難場所",
    "locationError.eyebrow": "LET'S TRY ANOTHER WAY",
    "locationError.title": "現在地を\n確認できませんでした。",
    "locationError.body": "位置情報が許可されていないか、取得に時間がかかっています。",
    "locationError.retry": "もう一度、現在地を取得する",
    "locationError.pin": "地図でピンを指定する",
    "locationError.saved": "家・学校から選ぶ",
    "locationError.note": "保存した避難場所は、通信や位置情報がなくても確認できます。",
    "noCandidates.eyebrow": "NO NEARBY CANDIDATE",
    "noCandidates.badgeTsunami": "津波に対応する施設",
    "noCandidates.title": "近くの対応施設が\n見つかりませんでした。",